osID,title,tier,tier_label,health_related,disease_areas,primary_disease_area,nlp_classified,ai_classified,ai_confidence,nlp_mesh_evidence,classification_source
SSRE-ON-ORBIT-CRYSTALS,Exploiting On-orbit Crystal properties for Structural Studies of Medically and Economically Important Targets,3,Uncertain,True,Cancer; Cardiovascular diseases; Endocrine and metabolic diseases; Rare inherited disorders,Cancer,False,True,0.6,,ai_low
SSRE-OPALS,Optical PAyload for Lasercomm Science,0,Not health-related,False,,,False,False,0.75,,none
SSRE-OPTICA,Onboard Programmable Technology for Image Compression and Analysis&nbsp,0,Not health-related,False,,,False,False,0.75,,none
SSRE-OPTICAL-IMAGING-OF-BUBBLE-DYNAMICS-ON-NANOSTRUCTURED-SURFACES,Optical Imaging of Bubble Dynamics on Nanostructured Surfaces,0,Not health-related,False,,,False,False,0.75,,none
SSRE-OPTIMAL-1,OPTIMAL-1,0,Not health-related,False,,,False,False,0.75,,none
SSRE-OPUSAT-II,Osaka Prefecture University Satellite-II,0,Not health-related,False,,,False,False,0.75,,none
SSRE-ORAL-BIOFILMS-IN-SPACE,Effect of Environmental Stressors on Oral Biofilm Growth and Treatment,3,Uncertain,True,Endocrine and metabolic diseases,Endocrine and metabolic diseases,False,True,0.4,,ai_low
SSRE-ORBITAL-ARCHITECTURE,Architectural Properties Impact on Stress and Cognition - Space Environment,2,Probable,True,Mental health; Neurological diseases,Mental health,False,True,0.95,,ai_high
SSRE-OREOCUBE,OREOcube,0,Not health-related,False,,,False,False,0.75,,none
SSRE-ORGANS-ON-CHIPS-AS-A-PLATFORM-FOR-STUDYING-EFFECTS-OF-MICROGRAVITY-ON-HUMAN-PHYSIOLOGY,Organs-On-Chips as a Platform for Studying Effects of Microgravity on Human Physiology,2,Probable,True,Cardiovascular diseases; Musculoskeletal diseases; Neurological diseases; Kidney diseases; Endocrine and metabolic diseases; Cancer,Cardiovascular diseases,False,True,0.85,,ai_high
SSRE-ORION-2,Ovarian Research In microgravity cONditions-2,2,Probable,True,Women's health; Endocrine and metabolic diseases; Cancer,Women's health,False,True,0.95,,ai_high
SSRE-ORZS,The Optimization of Root Zone Substrates (ORZS) for Reduced Gravity Experiments Program,0,Not health-related,False,,,False,False,0.75,,none
SSRE-OSIRIS-3U,OSIRIS-3U,0,Not health-related,False,,,False,False,0.75,,none
SSRE-OSTEO-4,Osteocytes and mechano-transduction,2,Probable,True,Musculoskeletal diseases; Endocrine and metabolic diseases,Musculoskeletal diseases,False,True,0.95,,ai_high
SSRE-OSTEOGENIC-CELLS,Osteogenic Cells,2,Probable,True,Musculoskeletal diseases; Endocrine and metabolic diseases,Musculoskeletal diseases,False,True,0.95,,ai_high
SSRE-OSTEOOMICS,Gravitational Regulation of Osteoblast Genomics and Metabolism,2,Probable,True,Musculoskeletal diseases; Endocrine and metabolic diseases,Musculoskeletal diseases,False,True,0.95,,ai_high
SSRE-OSTEOPROMOTIVE-BONE-ADHESIVE,Effects of an Osteopromotive Bone Adhesive on Skeletal Stem Cells and Bone Regeneration,2,Probable,True,Musculoskeletal diseases,Musculoskeletal diseases,False,True,0.9,,ai_high
SSRE-OTKLIK,Otklik,0,Not health-related,False,,,False,False,0.75,,none
SSRE-OTOLITH,Otolith Assessment During Postflight Re-adaptation,1,Confirmed,True,Neurological diseases; Cardiovascular diseases; Rare inherited disorders,Neurological diseases,True,True,0.85,D018754|D010505|D014717,nlp+ai
SSRE-OVAR,"Off-Vertical Axis Rotation: Eye Movements and Motion Perception Induced By Off-Axis Rotation at Small Angles of Tilt After Spaceflight, DSO 499",2,Probable,True,Neurological diseases; Eye diseases,Neurological diseases,False,True,0.9,,ai_high
SSRE-OVOSPACE,Modulation of Granulosa and Theca Cells Activity in Microgravity: Consequences for Human Health and Reproduction,2,Probable,True,Women's health; Endocrine and metabolic diseases,Women's health,False,True,0.95,,ai_high
SSRE-OXYGEN-PRODUCTION-IN-ALGAE,<div> The Effects of Microgravity on Oxygen Output Regarding <em>Chlorella vulgaris</em></div> </div> <div> &nbsp,0,Not health-related,False,,,False,False,0.75,,none
SSRE-PACE,Preliminary Advanced Colloids Experiment: 100X Oil Test Target,0,Not health-related,False,,,False,False,0.75,,none
SSRE-PACE-2,Preliminary Advanced Colloids Experiment - 2: 3D Particle Test,0,Not health-related,False,,,False,False,0.75,,none
SSRE-PACE-LMM-BIO,Preliminary Advanced Colloids Experiment - Light Microscopy Module: Biological Samples,0,Not health-related,False,,,False,False,0.75,,none
SSRE-PADIAC,PAthway DIfferent ACtivators,0,Not health-related,False,,,False,False,0.75,,none
SSRE-PALM-TREE-GROWTH,UAE Palm Tree Growth Experiment,0,Not health-related,False,,,False,False,0.75,,none
SSRE-PALOMINO-PATHFINDER-1,PALOMINO Pathfinder 1,0,Not health-related,False,,,False,False,0.75,,none
SSRE-PAPELL,Pump Application using Pulsed Electromagnets for Liquid reLocation,0,Not health-related,False,,,False,False,0.75,,none
SSRE-PARODONT-PARODENTIUM,Study of the Condition of Periodontal Tissues in Space Flight (Parodont (Parodentium)),2,Probable,True,Musculoskeletal diseases,Musculoskeletal diseases,False,True,0.85,,ai_high
SSRE-PARODONT-2-PARODENTIUM-2,Parodont-2 (Parodentium-2),2,Probable,True,Musculoskeletal diseases,Musculoskeletal diseases,False,True,0.75,,ai_high
SSRE-PARTICLE-FLUX,Particle Flux Demonstrator,0,Not health-related,False,,,False,False,0.75,,none
SSRE-PARTICLE-VIBRATION,Thermovibrationally-driven Particle self-Assembly and Ordering mechanisms in Low grAvity,0,Not health-related,False,,,False,False,0.75,,none
SSRE-PASSAGES,Scaling Body-Related Actions in the Absence of Gravity,2,Probable,True,Eye diseases; Mental health,Eye diseases,False,True,0.9,,ai_high
SSRE-PASSIVE-THERMAL-FLIGHT-EXPERIMENT,Passive Thermal Flight Experiment,0,Not health-related,False,,,False,False,0.75,,none
SSRE-PATCOOL,PAssive Thermal Coating Observatory Operating in Low earth orbit,0,Not health-related,False,,,False,False,0.75,,none
SSRE-PBRE,Packed Bed Reactor Experiment,0,Not health-related,False,,,False,False,0.75,,none
SSRE-PBRE-2,Packed Bed Reactor Experiment-2,0,Not health-related,False,,,False,False,0.75,,none
SSRE-PBRE-WR,Packed Bed Reactor Experiment-Water Recovery,0,Not health-related,False,,,False,False,0.75,,none
SSRE-PBRE-WRS,PBRE-WRS,0,Not health-related,False,,,False,False,0.75,,none
SSRE-PC4NC,Protein Crystals for Neutron Crystallography (PC4NC) Large volume crystal growth of Inorganic Pyrophosphatase complexes by counter-diffusion in microgravity for neutron diffraction studies,3,Uncertain,True,Endocrine and metabolic diseases; Musculoskeletal diseases; Rare inherited disorders,Endocrine and metabolic diseases,False,True,0.6,,ai_low
SSRE-PCDF,Protein Crystallization Diagnostics Facility,3,Uncertain,True,Cancer; Rare inherited disorders; Endocrine and metabolic diseases; Neurological diseases; Cardiovascular diseases,Cancer,False,True,0.6,,ai_low
SSRE-PCG-EGN,Protein Crystal Growth-Enhanced Gaseous Nitrogen Dewar,3,Uncertain,True,Cancer; Rare inherited disorders; Endocrine and metabolic diseases,Cancer,False,True,0.6,,ai_low
SSRE-PCG-STES-IDQC,Protein Crystal Growth-Single Locker Thermal Enclosure System-Improved Diffraction Quality of Crystals,2,Probable,True,Cancer; Cardiovascular diseases; Neurological diseases; Rare inherited disorders; Endocrine and metabolic diseases,Cancer,False,True,0.7,,ai_high
SSRE-PCG-STES-IMP,Protein Crystal Growth-Single Locker Thermal Enclosure System-Crystallization of the Integral Membrane Protein Using Microgravity,3,Uncertain,True,Cancer; Cardiovascular diseases; Neurological diseases; Endocrine and metabolic diseases,Cancer,False,True,0.6,,ai_low
SSRE-PCG-STES-MM,Protein Crystal Growth-Single Locker Thermal Enclosure System-Synchrotron Based Mosaicity Measurements of Crystal Quality and Theoretical Modeling,3,Uncertain,True,Cancer; Rare inherited disorders; Endocrine and metabolic diseases; Neurological diseases,Cancer,False,True,0.6,,ai_low
SSRE-PCG-STES-MMTP,Protein Crystal Growth-Single Locker Thermal Enclosure System-Crystallization of the Mitochondrial Metabolite Transport Proteins,2,Probable,True,Endocrine and metabolic diseases; Rare inherited disorders; Neurological diseases; Cardiovascular diseases; Cancer,Endocrine and metabolic diseases,False,True,0.85,,ai_high
SSRE-PCG-STES-MS,Protein Crystal Growth-Single Locker Thermal Enclosure System - Crystal Growth Model System for Material Science,0,Not health-related,False,,,False,False,0.75,,none
SSRE-PCG-STES-RDP,Protein Crystal Growth-Single Locker Thermal Enclosure System-Engineering a Ribozyme for Diffraction Properties,2,Probable,True,Cancer; Rare inherited disorders; Neurological diseases,Cancer,False,True,0.75,,ai_high
SSRE-PCG-STES-RGE,Protein Crystal Growth-Single Locker Thermal Enclosure System-Regulation of Gene Expression,3,Uncertain,True,Cancer; Rare inherited disorders; Endocrine and metabolic diseases,Cancer,False,True,0.6,,ai_low
SSRE-PCG-STES-SA,Protein Crystal Growth-Single Locker Thermal Enclosure System-Science and Applications of Facility Hardware for Protein Crystal Growth,3,Uncertain,True,Cancer; Cardiovascular diseases; Neurological diseases; Rare inherited disorders; Endocrine and metabolic diseases,Cancer,False,True,0.6,,ai_low
SSRE-PCG-STES-VEKS,Protein Crystal Growth-Single Locker Thermal Enclosure System-Vapor Equilibrium Kinetics Studies,3,Uncertain,True,Cancer; Rare inherited disorders; Endocrine and metabolic diseases; Neurological diseases,Cancer,False,True,0.6,,ai_low
SSRE-PERFECT-CRYSTALS,"Growth of Large, Perfect Protein Crystals for Neutron Crystallography",3,Uncertain,True,Cancer; Rare inherited disorders; Neurological diseases; Endocrine and metabolic diseases,Cancer,False,True,0.6,,ai_low
SSRE-PERSEO,PErsonal Radiation Shielding for intErplanetary missiOns,2,Probable,True,Cancer; Cardiovascular diseases; Neurological diseases; Eye diseases,Cancer,False,True,0.95,,ai_high
SSRE-PERSONAL-CO2-MONITOR,Personal CO2 Monitor,2,Probable,True,Cardiovascular diseases; Neurological diseases; Mental health,Cardiovascular diseases,False,True,0.7,,ai_high
SSRE-PERSPECTIVES,PERSPECTIVES,0,Not health-related,False,,,False,False,0.75,,none
SSRE-PESTO,Photosynthesis Experiment and System Testing and Operation,0,Not health-related,False,,,False,False,0.75,,none
SSRE-PETITSAT,Plasma Enhancements in the Ionosphere-Thermosphere,0,Not health-related,False,,,False,False,0.75,,none
SSRE-PETRI-PLANTS-2,Characterizing <em>Arabidopsis</em> Root Attractions-2,0,Not health-related,False,,,False,False,0.75,,none
SSRE-PFE-OUM,Periodic Fitness Evaluation with Oxygen Uptake Measurement,2,Probable,True,Cardiovascular diseases; Musculoskeletal diseases; Endocrine and metabolic diseases,Cardiovascular diseases,False,True,0.95,,ai_high
SSRE-PFMI,Toward Understanding Pore Formation and Mobility During Controlled Directional Solidification in a Microgravity Environment,0,Not health-related,False,,,True,False,0.75,,none
SSRE-PFMI-ASCENT,Asymmetric Sawtooth and Cavity-Enhanced Nucleation-Driven Transport,0,Not health-related,False,,,False,False,0.75,,none
SSRE-PGBA,Plant Generic Bioprocessing Apparatus,0,Not health-related,False,,,False,False,0.75,,none
SSRE-PGTIDE,P&amp;G Telescience Investigation of Detergent Experiments,0,Not health-related,False,,,False,False,0.75,,none
SSRE-PHAGE-EVOLUTION,Evolution of New Phage-Bacteria Interactions from Exposure to Space Environment,3,Uncertain,True,Cancer; Rare inherited disorders,Cancer,False,True,0.3,,ai_low
SSRE-PHARMA,Research on the Particulars of Pharmacological Effects During Long-term Spaceflight (Pharma),0,Not health-related,False,,,True,True,0.9,,none
SSRE-PHARMACEUTICAL-EXCIPIENT-INGREDIENT-STABILITY-IN-MICROGRAVITY,Evaluation of Long-Term Stability of Pharmaceutical Ingredients in an Excipient Matrix for Use in Potential Future On-Orbit Manufacturing,3,Uncertain,True,Cardiovascular diseases; Kidney diseases; Cancer; Neurological diseases; Eye diseases; Rare inherited disorders; Women's health; Endocrine and metabolic diseases; Musculoskeletal diseases; Mental health,Cardiovascular diseases,False,True,0.3,,ai_low
SSRE-PHARMACOKINETICS,"Pharmacokinetics and Contributing Physiologic Changes During Spaceflight, DSO 632B",2,Probable,True,Cardiovascular diseases; Endocrine and metabolic diseases; Kidney diseases,Cardiovascular diseases,False,True,0.7,,ai_high
SSRE-PHASE-CHANGE-HX,Phase Change Heat Exchanger&nbsp;Project,0,Not health-related,False,,,False,False,0.75,,none
SSRE-PHOENIX-CUBESAT,Phoenix CubeSat,0,Not health-related,False,,,False,False,0.75,,none
SSRE-PHOSPHO-AGING,Phospho-aging Mechanism of Accelerated Aging Under Microgravity,2,Probable,True,Musculoskeletal diseases; Endocrine and metabolic diseases; Cardiovascular diseases; Neurological diseases,Musculoskeletal diseases,False,True,0.85,,ai_high
SSRE-PHOTOBIOREACTOR,Photobioreactor,0,Not health-related,False,,,False,False,0.75,,none
SSRE-PHOTONGRAV,Thoughts over Gravity &ndash; a Test of Using fNIRS-based Brain-Computer Interface in LEO Conditions,2,Probable,True,Neurological diseases,Neurological diseases,False,True,0.9,,ai_high
SSRE-PHOTOSYNTH,Photosynth<sup>TM</sup> Three-Dimensional Modeling of ISS Interior and Exterior,0,Not health-related,False,,,False,False,0.75,,none
SSRE-PHYSIOTOOL,Comprehensive and Ambulatory Physiological Monitoring in Space with PhysioTool,2,Probable,True,Cardiovascular diseases; Musculoskeletal diseases; Endocrine and metabolic diseases; Neurological diseases; Mental health,Cardiovascular diseases,False,True,0.85,,ai_high
SSRE-PICODRAGON,PicoDragon,0,Not health-related,False,,,False,False,0.75,,none
SSRE-PICTURE,Picture,0,Not health-related,False,,,False,False,0.75,,none
SSRE-PILLE-ISS,Pille-MKS: Determine the Value of the Accumulated Radiation Dose in a Visiting Crewmember,2,Probable,True,Cancer; Cardiovascular diseases; Neurological diseases; Eye diseases,Cancer,False,True,0.95,,ai_high
SSRE-PILLE-SYMONIE,Pille-Symonie,0,Not health-related,False,,,False,True,0.7,,none
SSRE-PILLE-SYMONIE-2,Pille-Symonie-2,0,Not health-related,False,,,False,True,0.85,,none
SSRE-PILOT-EGRESS-FITNESS,Validation of Fitness for Duty Standards Using Pre- and Post-flight Capsule Egress and Suited Functional Performance Tasks in Simulated Reduced Gravity - Pilot,2,Probable,True,Cardiovascular diseases; Musculoskeletal diseases; Neurological diseases,Cardiovascular diseases,False,True,0.8,,ai_high
SSRE-PILOT-DEYATELNOST,Study of the Individual Features of the Psychological and Physiological Regulator of the State and Reliability of Work Performance in Crewmembers in Long-Term Spaceflight (Pilot-Deyatelnost),2,Probable,True,Cardiovascular diseases; Mental health,Cardiovascular diseases,False,True,0.9,,ai_high
SSRE-PILOTE,Pilote,0,Not health-related,False,,,False,False,0.75,,none
SSRE-PILOT-REGULYATSIA,Study of the Individual Features of the Psychological and Physiological Regulator of the State and Reliability of Work Performance in Crewmembers in Long-Term Spaceflight (Pilot-Regulyatsia),2,Probable,True,Cardiovascular diseases; Mental health,Cardiovascular diseases,False,True,0.9,,ai_high
SSRE-PILOT-ROBOT,Study of the Individual Features of the Psychological and Physiological Regulator of the State and Reliability of Work Performance in Crewmembers in Long-Term Spaceflight (Pilot-Robot),2,Probable,True,Mental health,Mental health,False,True,0.9,,ai_high
SSRE-PILOT-T,Pilot-T,0,Not health-related,False,,,False,False,0.75,,none
SSRE-PIRPL,Prototype InfraRed Payload,0,Not health-related,False,,,False,False,0.75,,none
SSRE-PK-3-PLUS,PK-3 Plus: Plasma Crystal Research on the ISS,0,Not health-related,False,,,False,False,0.75,,none
SSRE-PK-4,Plasma Kristall-4,0,Not health-related,False,,,False,False,0.75,,none
SSRE-PKINASE,Mechanisms and Functional Consequences of Protein Kinase C Isoform Translocation in Monocytes Exposed to Microgravity,2,Probable,True,Musculoskeletal diseases,Musculoskeletal diseases,False,True,0.9,,ai_high
SSRE-PKINASE-ROSCOSMOS,Studying Plasma Dust Crystals and Liquids in Microgravity on the ISS RS - PKINASE- Roscosmos,0,Not health-related,False,,,False,False,0.75,,none
SSRE-PLANT-CELL-DIVISION,The Effects of the Space Environment on Cell Division in Plants,0,Not health-related,False,,,False,False,0.75,,none
SSRE-PLANT-GRAVITY-PERCEPTION,Gravity Perception Systems,2,Probable,True,Neurological diseases; Eye diseases,Neurological diseases,False,True,0.85,,ai_high
SSRE-PLANT-GRAVITY-SENSING,Utilization of the micro gravity condition to examine the cellular process of formation of the gravity sensor and the molecular mechanism of gravity sensing,3,Uncertain,True,Neurological diseases; Musculoskeletal diseases,Neurological diseases,False,True,0.6,,ai_low
SSRE-PLANT-HABITAT-01,PH-01:&nbsp; An Integrated Omics Guided Approach to Lignification and Gravitational Responses: The Final Frontier,0,Not health-related,False,,,False,False,0.75,,none
SSRE-PLANT-HABITAT-02,Assessment of Nutritional Value and Growth Parameters of Space-grown Plants,3,Uncertain,True,Endocrine and metabolic diseases; Musculoskeletal diseases,Endocrine and metabolic diseases,False,True,0.6,,ai_low
SSRE-PLANT-HABITAT-03,Epigenetic Adaptation to the Spaceflight Environment - Accumulated Genomic Change Induced by Generations in Space,2,Probable,True,Cancer; Rare inherited disorders; Endocrine and metabolic diseases; Neurological diseases,Cancer,False,True,0.85,,ai_high
SSRE-PLANT-HABITAT-04,Microgravity Growth of New Mexico Hatch Green Chile as a Technical Display of Advanced Plant Habitat&rsquo;s Capabilities,0,Not health-related,False,,,False,False,0.75,,none
SSRE-PLANT-HABITAT-05,Unlocking the Cotton Genome to Precision Genetics,0,Not health-related,False,,,False,False,0.75,,none
SSRE-PLANT-HABITAT-06,Effect of Spaceflight and Simulated Microgravity on Plant Defense Responses,0,Not health-related,False,,,False,False,0.75,,none
SSRE-PLANT-HABITAT-07,Spaceflight Microbiome of a Food Crop Grown Using Different Substrate Moisture Levels,0,Not health-related,False,,,False,False,0.75,,none
SSRE-PLANT-RNA-REGULATION,Transcriptional and Post Transcriptional Regulation of Seedling Development in Microgravity,0,Not health-related,False,,,False,False,0.75,,none
SSRE-PLANT-ROTATION,Plant circumnutation and its dependence on the gravity response,0,Not health-related,False,,,False,False,0.75,,none
SSRE-PLANT-SIGNALING,Plant Signaling (formerly known as Seed Growth-1),0,Not health-related,False,,,False,False,0.75,,none
SSRE-PLANT-UV-B,Study on Plant Responses Against the Stresses of Microgravity and High Ultraviolet Radiation in Space,0,Not health-related,False,,,False,False,0.75,,none
SSRE-PLANT-WATER-MANAGEMENT,Plant Water Management,0,Not health-related,False,,,False,False,0.75,,none
SSRE-PLANT-WATER-MANAGEMENT-3-AND-4,Plant Water Management 3 and 4,0,Not health-related,False,,,False,False,0.75,,none
SSRE-PLANT-WATER-MANAGEMENT-5-AND-6,Plant Water Management 5 and 6,0,Not health-related,False,,,False,False,0.75,,none
SSRE-PLASMA-INTERACTION-MODEL,Analysis of International Space Station Plasma Interaction,0,Not health-related,False,,,False,False,0.75,,none
SSRE-PLASMONIC-BUBBLES,Plasmonic Bubble Enabled Nanoparticle Deposition under Microgravity,0,Not health-related,False,,,False,False,0.75,,none
SSRE-PLATAN-ARGON,Searching for Low-Energy Heavy Nuclei of Solar and Galactic Origin using the PLAstic Track ANalyzer- Argon (PLATAN- Argon),0,Not health-related,False,,,False,False,0.75,,none
SSRE-PLATAN-COSMIC-RAYS,Search for Low Energy Heavy Particles of Solar and Galactic Origin,0,Not health-related,False,,,False,False,0.75,,none
SSRE-PLATAN-FERRUM,Searching for Low-Energy Heavy Nuclei of Solar and Galactic Origin using the PLAstic Track ANalyzer- Ferrum) (Platan-Ferrum),0,Not health-related,False,,,False,False,0.75,,none
SSRE-PLATAN-FERRUM-GALACTIC-COSMIC-RAYS,Searching for Low-Energy Heavy Nuclei of Solar and Galactic Origin using the PLAstic Track ANalyzer-Ferrum Galactic Cosmic Rays (PLATAN-Ferrum Galactic Cosmic Rays),2,Probable,True,Cancer; Neurological diseases,Cancer,False,True,0.7,,ai_high
SSRE-PLATAN-FERRUM-ISS,Platan-Ferrum ISS,0,Not health-related,False,,,False,False,0.75,,none
SSRE-PLATAN-ISS,Searching for Low-Energy Heavy Nuclei of Solar and Galactic Origin using the PLAstic Track ANalyzer- ISS (PLATAN- ISS),2,Probable,True,Cancer; Neurological diseases,Cancer,False,True,0.7,,ai_high
SSRE-PLATAN-SUN,Searching for Low-Energy Heavy Nuclei of Solar and Galactic Origin using the PLAstic Track ANalyzer- Sun (PLATAN- Sun),2,Probable,True,Cancer; Neurological diseases,Cancer,False,True,0.7,,ai_high
SSRE-PLATE-READER-ELISA-KIT,Plate Reader &amp; ELISA Kit,3,Uncertain,True,Cardiovascular diseases; Kidney diseases; Cancer; Endocrine and metabolic diseases; Musculoskeletal diseases,Cardiovascular diseases,False,True,0.4,,ai_low
SSRE-PLAZMA-MKS,Plasma-ISS: Examination of Plasmic Environments on the External Surface of ISS Through the Characterization of Optical Radiance,0,Not health-related,False,,,False,False,0.75,,none
SSRE-PLAZMA-PROGRESS-PLASMA-PROGRESS,Observation of the Reflective Characteristics of the Spacecraft Plasma Environment during Engine Firing in Space Using Ground-Based Instruments (Plazma-Progress),0,Not health-related,False,,,False,False,0.75,,none
SSRE-PLAZMIDA-PLASMID,Transfer of Plasmid DNA During Conjugation in Spaceflight (Plazmida),3,Uncertain,True,Rare inherited disorders; Cancer,Rare inherited disorders,False,True,0.4,,ai_low
SSRE-PMDIS,Perceptual Motor Deficits in Space,2,Probable,True,Neurological diseases; Eye diseases; Musculoskeletal diseases,Neurological diseases,False,True,0.85,,ai_high
SSRE-PMT,Photocatalyst Material Test,0,Not health-related,False,,,False,False,0.75,,none
SSRE-PNEVMOCARD-PNEUMOCARD,"Study of the Impact of Spaceflight Factors on the Vegetative Regulation of Blood Circulation, Respiration, and Contractile Function of the Heart in Long-Term Spaceflight (Pnevmocard)",2,Probable,True,Cardiovascular diseases,Cardiovascular diseases,False,True,0.9,,ai_high
SSRE-PNEVMOCARD-PERFECTION-PNEUMOCARD-PERFECTION,"Study of the Impact of Spaceflight Factors on the Vegetative Regulation of Blood Circulation, Respiration, and Contractile Function of the Heart in Long-Term Spaceflight (Pnevmocard Perfection)",2,Probable,True,Cardiovascular diseases,Cardiovascular diseases,False,True,0.9,,ai_high
SSRE-POEMS,Passive Observatories for Experimental Microbial Systems,0,Not health-related,False,,,False,False,0.75,,none
SSRE-POISK-PK-3-1-RECONNAISSANCE-PK-3-1,Studying Plasma Dust Crystals and Liquids in Microgravity on the ISS RS - Poisk-PK-3-1,0,Not health-related,False,,,False,False,0.75,,none
SSRE-POISK-PK-3-2-RECONNAISSANCE-PK-3-2,Studying Plasma Dust Crystals and Liquids in Microgravity on the ISS RS - Poisk-PK-3-2,0,Not health-related,False,,,False,False,0.75,,none
SSRE-POLCA,Effect of weightlessness on the distribution of calcium in the statocytes of Rapeseed roots (<em>Brassica napus</em>),3,Uncertain,True,Musculoskeletal diseases; Endocrine and metabolic diseases,Musculoskeletal diseases,False,True,0.6,,ai_low
SSRE-POLIGEN-POLYGENE,Identifying the Genetic Features Determining Individual differences in the Resilience of Biological Objects to Long-term Spaceflight Factors Studies with the Fruit Fly Drosophila melanogaster (Poligen),2,Probable,True,Rare inherited disorders; Endocrine and metabolic diseases; Musculoskeletal diseases; Cardiovascular diseases,Rare inherited disorders,False,True,0.75,,ai_high
SSRE-POLYMER-CONVECTION,Polymer Convection,0,Not health-related,False,,,False,False,0.75,,none
SSRE-POPULAR-MECHANICS,Commercial Promotion of Popular Mechanics Journal,0,Not health-related,False,,,False,False,0.75,,none
SSRE-PORTABLE-ON-BOARD-PRINTER-3D,Portable On Board Printer 3D,0,Not health-related,False,,,False,False,0.75,,none
SSRE-POVERKHNOSTNYE-VOLNY-PK-SURFACE-WAVES-PK,Studying Plasma Dust Crystals and Liquids in Microgravity on the ISS RS - Poverkhnostnye Volny-PK,0,Not health-related,False,,,False,False,0.75,,none
SSRE-PRANET-ALGAL-AX-3,Pranet Algal,0,Not health-related,False,,,False,False,0.75,,none
SSRE-PRCUNAR2,Puerto Rico CubeSat NanoRocks 2,0,Not health-related,False,,,False,False,0.75,,none
SSRE-PRELIMINARY-STUDIES-FOR-IN-SPACE-MANUFACTURING-APPLICATIONS,Preliminary Studies for In-Space Manufacturing Applications,0,Not health-related,False,,,False,False,0.75,,none
SSRE-PRISMSPACE-1,PRISMSpace-1,0,Not health-related,False,,,False,False,0.75,,none
SSRE-PRIVYAZKA,High-Accuracy Spatial Orientation of Scientific Devices Taking in Account the ISS Hull Deformation,0,Not health-related,False,,,False,False,0.75,,none
SSRE-PRO-K,Dietary Intake Can Predict and Protect Against Changes in Bone Metabolism during Spaceflight and Recovery,1,Confirmed,True,Cardiovascular diseases,Cardiovascular diseases,True,True,0.9,D054556,nlp+ai
SSRE-PROBIOTICS,Study for evaluating the impact of continuous consumption of probiotics on immune function and intestinal microbiota in astronauts under closed microgravity environment,2,Probable,True,Endocrine and metabolic diseases; Mental health; Musculoskeletal diseases,Endocrine and metabolic diseases,False,True,0.85,,ai_high
SSRE-PROBOJ-PENETRATION,Proboj (Penetration),0,Not health-related,False,,,False,False,0.75,,none
SSRE-PRODUCTION-OF-STEM-CELLS-FOR-PERSONALIZED-MEDICINE,Study of Induced Pluripotent Stem Cells (iPSCs) in Microgravity,3,Uncertain,True,Cardiovascular diseases; Neurological diseases; Cancer; Rare inherited disorders; Musculoskeletal diseases; Endocrine and metabolic diseases,Cardiovascular diseases,False,True,0.6,,ai_low
SSRE-PRODUTSENT,Produtsent,0,Not health-related,False,,,False,False,0.75,,none
SSRE-PROFILAKTIKA-1-PROPHYLAXIS-1,Mechanism of Activity and Effectiveness of Various Countermeasures Intended to Prevent Disruptions to the Motor Apparatus in Microgravity (Profilaktika-1 (Prophylaxis-1)),2,Probable,True,Musculoskeletal diseases,Musculoskeletal diseases,False,True,0.9,,ai_high
