osID,title,tier,tier_label,health_related,disease_areas,primary_disease_area,nlp_classified,ai_classified,ai_confidence,nlp_mesh_evidence,classification_source
SSRE-FINE-MOTOR-SKILLS,Effects of Long-Duration Microgravity on Fine Motor Skills: 1 year ISS Investigation,2,Probable,True,Neurological diseases; Musculoskeletal diseases,Neurological diseases,False,True,0.85,,ai_high
SSRE-FIS,Sensory (Taste) Evaluation of Malaysian Food on Earth and in Space,3,Uncertain,True,Endocrine and metabolic diseases; Neurological diseases,Endocrine and metabolic diseases,False,True,0.4,,ai_low
SSRE-FISCHER-RAT-THYROID-LOW-SERUM-5,Fischer Rat Thyroid Low Serum 5%,2,Probable,True,Cancer; Endocrine and metabolic diseases,Cancer,False,True,0.85,,ai_high
SSRE-FISH-SCALES,Investigation of the Osteoclastic and Osteoblastic Responses to Microgravity Using Goldfish Scales,2,Probable,True,Endocrine and metabolic diseases; Musculoskeletal diseases; Mental health,Endocrine and metabolic diseases,False,True,0.9,,ai_high
SSRE-FIT,"Fungal Pathogenesis, Tumorigenesis, and Effects of Host Immunity in Space",2,Probable,True,Cancer; Rare inherited disorders,Cancer,False,True,0.95,,ai_high
SSRE-FITSAT-1,FITSAT-1,0,Not health-related,False,,,False,False,0.75,,none
SSRE-FIZIKA-OBRAZOVANIE-FAZA,"Scientific and Educational Demonstration of Physical Laws and Phenomena in Microgravity (Fizika-Obrazovaniye, Fizika-Faza)",0,Not health-related,False,,,False,False,0.75,,none
SSRE-FIZIKA-OBRAZOVANIE-LT,"Scientific and Educational Demonstration of Physical Laws and Phenomena in Microgravity (Fizika-Obrazovaniye, Fizika-LT)",0,Not health-related,False,,,False,False,0.75,,none
SSRE-FIZIKA-OBRAZOVANIE-OTOLIT,"Scientific and Educational Demonstration of Physical Laws and Phenomena in Microgravity (Fizika-Obrazovaniye, Fizika-Otolit)",0,Not health-related,False,,,False,False,0.75,,none
SSRE-FLAME-DESIGN,Flame Design,0,Not health-related,False,,,False,False,0.75,,none
SSRE-FLARE,Fundamental Research on International Standard of Fire Safety in Space &ndash; Base for Safety of Future Manned Missions,0,Not health-related,False,,,True,False,0.75,,none
SSRE-FLATWORM-REGENERATION,KS5: Role of Gravity and Geomagnetic Field in Flatworm Regeneration,2,Probable,True,Mental health,Mental health,False,True,0.9,,ai_high
SSRE-FLAWLESS-SPACE-FIBERS-1,Production of Flawless Space Fiber,0,Not health-related,False,,,False,False,0.75,,none
SSRE-FLEX,Flame Extinguishment Experiment,0,Not health-related,False,,,False,False,0.75,,none
SSRE-FLEX-2,Flame Extinguishment Experiment - 2,0,Not health-related,False,,,False,False,0.75,,none
SSRE-FLEX-2J,Flame Extinguishment Experiment -2 JAXA,0,Not health-related,False,,,False,False,0.75,,none
SSRE-FLOW-CHEMISTRY-PLATFORM-FOR-SYNTHETIC-REACTIONS-ON-ISS,Flow Chemistry Platform for Synthetic Reactions on ISS,0,Not health-related,False,,,False,False,0.75,,none
SSRE-FLUID-PARTICLES,<span>ISS: Uncovering Transient Dynamics and Equilibrium States of Particle Aggregates in Fluids</span>,0,Not health-related,False,,,False,False,0.75,,none
SSRE-FLUID-SHIFTS,"Fluid Shifts Before, During and After Prolonged Space Flight and Their Association with Intracranial Pressure and Visual Impairment",1,Confirmed,True,Eye diseases; Neurological diseases,Eye diseases,True,True,0.9,D014786|D010211,nlp+ai
SSRE-FLUIDIC-SPACE-OPTICS-AX-1,Fluidic Space Optics,0,Not health-related,False,,,False,False,0.75,,none
SSRE-FLUIDICS,Fluid Dynamics in Space,0,Not health-related,False,,,False,False,0.75,,none
SSRE-FLUMIAS-DEA,FLUMIAS-DEA,0,Not health-related,False,,,False,False,0.75,,none
SSRE-FMVM,Fluid Merging Viscosity Measurement,0,Not health-related,False,,,False,False,0.75,,none
SSRE-FNS,Fast Neutron Spectrometer,0,Not health-related,False,,,False,False,0.75,,none
SSRE-FOAM,Viscous Liquid Foam - Bulk Metallic Glass,0,Not health-related,False,,,False,False,0.75,,none
SSRE-FOAMS-AND-EMULSIONS,Structure and Stability of Foams and Emulsions,0,Not health-related,False,,,False,False,0.75,,none
SSRE-FOAM-STABILITY,Foam Optics And Mechanics - Stability,0,Not health-related,False,,,False,False,0.75,,none
SSRE-FOB,Forward Osmosis Bag,0,Not health-related,False,,,False,False,0.75,,none
SSRE-FOCUS,Foam Casting and Utilization in Space,0,Not health-related,False,,,False,False,0.75,,none
SSRE-FOOD-ACCEPTABILITY,"Food Acceptability, Menu Fatigue, and Aversion in ISS Missions",2,Probable,True,Mental health,Mental health,False,True,0.9,,ai_high
SSRE-FOOD-EXPERIENCE-AX-3,Food Experience (Ax-3),0,Not health-related,False,,,False,True,0.5,,none
SSRE-FOOD-PHYSIOLOGY,"The Integrated Impact of Diet on Human Immune Response, the Gut Microbiota, and Nutritional Status During Adaptation to Spaceflight",2,Probable,True,Endocrine and metabolic diseases; Musculoskeletal diseases; Neurological diseases,Endocrine and metabolic diseases,False,True,0.9,,ai_high
SSRE-FOOD-PROCESSOR,Advanced System for Space Food,3,Uncertain,True,Endocrine and metabolic diseases; Musculoskeletal diseases; Cardiovascular diseases,Endocrine and metabolic diseases,False,True,0.6,,ai_low
SSRE-FOOT,Foot Reaction Forces During Space Flight,2,Probable,True,Musculoskeletal diseases; Cardiovascular diseases,Musculoskeletal diseases,False,True,0.9,,ai_high
SSRE-FORAS-PROMINEO,Foras Promineo,0,Not health-related,False,,,False,False,0.75,,none
SSRE-FORCE-SHOES,In-flight Demonstration of Portable Load Monitoring Devices-Phase I: XSENS ForceShoe<sup>TM</sup>,2,Probable,True,Musculoskeletal diseases; Cardiovascular diseases,Musculoskeletal diseases,False,True,0.85,,ai_high
SSRE-FORMIROVANIE-VIKHREY-PK,Studying Plasma Dust Crystals and Liquids in Microgravity on the ISS RS - Formirovanie Vikhrey-PK,0,Not health-related,False,,,False,False,0.75,,none
SSRE-FORWARD-OSMOSIS-MEMBRANE,Assessing the Performance of Urease-phospholipid Reactive Forward Osmosis Membranes for Water Reclamation Aboard the ISS,3,Uncertain,True,Kidney diseases,Kidney diseases,False,True,0.6,,ai_low
SSRE-FOUR-BED-CO2-SCRUBBER,Four Bed CO<sub>2</sub> Scrubber,0,Not health-related,False,,,False,False,0.75,,none
SSRE-FRAGILITY,The Origin of Fragility in High-temperature Oxide Liquids - Towards Fabrication of Novel Non-equilibrium Oxide Materials,0,Not health-related,False,,,False,False,0.75,,none
SSRE-FREEDOM,FREEDOM,0,Not health-related,False,,,False,False,0.75,,none
SSRE-FREE-SPACE-PADLES,Space Radiation Dosimeter by Free-Space PADLES in ISS JEM Exposed area,2,Probable,True,Cancer; Cardiovascular diseases; Neurological diseases,Cancer,False,True,0.85,,ai_high
SSRE-FRONT-KRISTALLIZATSII-PK-CRYSTALLIZATION-FRONT-PK,Studying Plasma Dust Crystals and Liquids in Microgravity on the ISS RS - Front Kristallizatsii-PK,0,Not health-related,False,,,False,False,0.75,,none
SSRE-FRUIT-FLY-DNA-REPAIR,Fruit Fly DNA Repair,2,Probable,True,Cancer; Rare inherited disorders; Neurological diseases,Cancer,False,True,0.85,,ai_high
SSRE-FRUIT-FLY-LAB-02-FFL-02,"The effects of microgravity on cardiac function, structure and gene expression using the <em>Drosophila </em>model",2,Probable,True,Cardiovascular diseases,Cardiovascular diseases,False,True,0.9,,ai_high
SSRE-FRUIT-FLY-LAB-01-FFL-01,ARC ISS Drosophila Experiment,3,Uncertain,True,Neurological diseases; Musculoskeletal diseases; Cardiovascular diseases; Rare inherited disorders,Neurological diseases,False,True,0.4,,ai_low
SSRE-FRUIT-FLY-LAB-03-FFL-03,Does Spaceflight Alter the Virulence of a Natural Parasite of <em>Drosophila</em>,3,Uncertain,True,Rare inherited disorders; Endocrine and metabolic diseases,Rare inherited disorders,False,True,0.3,,ai_low
SSRE-FSL-SOFT-MATTER-DYNAMICS-COMPGRAN,FSL Soft Matter Dynamics - Compaction and Sound Transmission in Dense Granular Media (COMPGRAN),0,Not health-related,False,,,False,False,0.75,,none
SSRE-FSL-SOFT-MATTER-DYNAMICS-FOAM,FSL Soft Matter Dynamics - Hydrodynamics of Wet Foams (FOAM),0,Not health-related,False,,,False,False,0.75,,none
SSRE-FSL-SOFT-MATTER-DYNAMICS-PASTA,FSL Soft Matter Dynamics - Particle STAbilised Emulsions and Foams (PASTA),0,Not health-related,False,,,False,False,0.75,,none
SSRE-FUNCTIONAL-IMMUNE,"Functional Immune Alterations, Latent Herpesvirus Reactivation, Physiological Stress and Clinical Incidence Onboard the International Space Station",2,Probable,True,Neurological diseases; Mental health; Endocrine and metabolic diseases,Neurological diseases,False,True,0.75,,ai_high
SSRE-FUNCTIONAL-TASK-TEST,Physiological Factors Contributing to Postflight Changes in Functional Performance,1,Confirmed,True,Neurological diseases,Neurological diseases,True,True,0.9,D003221|D065635|D054971,nlp+ai
SSRE-FURPHY,Residual Momentum and Tank Dynamics in Microgravity Environment,0,Not health-related,False,,,False,False,0.75,,none
SSRE-FUTABA,Kyushu Institute of Technology Student Satellite Development Project FUTABA,0,Not health-related,False,,,False,False,0.75,,none
SSRE-FUTURE-ENGINEERS-TWO-FOR-THE-CREW,Future Engineers - Two for the Crew,0,Not health-related,False,,,False,False,0.75,,none
SSRE-GARDENS,Growing Advanced and Refined space Development ENgineering succession and under the satellite,0,Not health-related,False,,,False,False,0.75,,none
SSRE-GARDENS-SAKURA,Growing Advanced and Refined space Development ENgineering succession and under the satellite,0,Not health-related,False,,,False,False,0.75,,none
SSRE-GARDENS-BOTAN,Growing Advanced and Refined space Development Engineering succession and under the satellite - BOTAN,0,Not health-related,False,,,False,False,0.75,,none
SSRE-GARDENS-YOMOGI,Growing Advanced and Refined space Development ENgineering succession and under the satellite - YOMOGI,0,Not health-related,False,,,False,False,0.75,,none
SSRE-GASPACS,Get Away Special Passive Attitude Control Satellite,0,Not health-related,False,,,False,False,0.75,,none
SSRE-GATOR-GATSBY,Gator GrAvitational effecTS on the faraday instaBilitY,0,Not health-related,False,,,False,False,0.75,,none
SSRE-GAUCHO-LUNG,Wicking in Gel-Coated Tubes,0,Not health-related,False,,,False,False,0.75,,none
SSRE-GCF-JAXA-NASDA-ROSCOSMOS,GCF-JAXA (NASDA)-Roscosmos,0,Not health-related,False,,,False,False,0.75,,none
SSRE-GEARRSAT,Globalstar Experiment And Risk Reduction Satellite,0,Not health-related,False,,,False,False,0.75,,none
SSRE-GEARS,CS-05A: Genomic Enumeration of Antibiotic Resistance in Space,2,Probable,True,,,False,True,0.75,,ai_high
SSRE-GECKO-GRIPPER,Gecko Gripper,0,Not health-related,False,,,False,False,0.75,,none
SSRE-GECKO-INSPIRED-ADHESIVE-GRASPING,Assistive Free-Flyers with Gecko-Inspired Adhesive Appendages for Automated Logistics in Space,0,Not health-related,False,,,False,False,0.75,,none
SSRE-GEDI,Global Ecosystem Dynamics Investigation,0,Not health-related,False,,,False,False,0.75,,none
SSRE-GEMATOLOGIA-HAEMATOLOGY,Study of Morphofunctional Properties of Blood Cells and Intensity of Erythropoiesis in Humans Subjected to Spaceflight Factors (Gematologiya),2,Probable,True,Cardiovascular diseases; Endocrine and metabolic diseases; Kidney diseases,Cardiovascular diseases,False,True,0.85,,ai_high
SSRE-GEMATOLOGIA-PERFECTION-HAEMATOLOGY-PERFECTION,Study of Morphofunctional Properties of Blood Cells and Intensity of Erythropoiesis in Humans Subjected to Spaceflight Factors (Gematologiya Perfection),1,Confirmed,True,Cardiovascular diseases,Cardiovascular diseases,True,True,0.9,D006333,nlp+ai
SSRE-GEM-B2,Polaris Bioremediation Science Experiment - Genetic Exchange in Microgravity for Biofilm Bioremediation,0,Not health-related,False,,,False,False,0.75,,none
SSRE-GENARA-A,Gravity Related Genes in <i>Arabidopsis</i> - A,0,Not health-related,False,,,False,False,0.75,,none
SSRE-GENE-EXPRESSION,Expression of Microbial Genes in Space,3,Uncertain,True,Cancer; Endocrine and metabolic diseases; Rare inherited disorders,Cancer,False,True,0.5,,ai_low
SSRE-GENES-IN-SPACE-1,Genes in Space-1,0,Not health-related,False,,,False,False,0.75,,none
SSRE-GENES-IN-SPACE-10,Genes in Space-10,0,Not health-related,False,,,False,False,0.75,,none
SSRE-GENES-IN-SPACE-11,Genes in Space-11,0,Not health-related,False,,,False,False,0.75,,none
SSRE-GENES-IN-SPACE-12,Genes in Space-12,0,Not health-related,False,,,False,False,0.75,,none
SSRE-GENES-IN-SPACE-2,Genes in Space-2,0,Not health-related,False,,,False,False,0.75,,none
SSRE-GENES-IN-SPACE-3,Genes in Space-3,0,Not health-related,False,,,False,False,0.75,,none
SSRE-GENES-IN-SPACE-4,Genes in Space-4,0,Not health-related,False,,,False,False,0.75,,none
SSRE-GENES-IN-SPACE-5,Genes in Space-5,0,Not health-related,False,,,False,False,0.75,,none
SSRE-GENES-IN-SPACE-6,Genes in Space-6,0,Not health-related,False,,,False,False,0.75,,none
SSRE-GENES-IN-SPACE-7,Genes in Space-7,0,Not health-related,False,,,False,False,0.75,,none
SSRE-GENES-IN-SPACE-8,Genes in Space-8,0,Not health-related,False,,,False,False,0.75,,none
SSRE-GENES-IN-SPACE-9,Genes in Space-9,0,Not health-related,False,,,False,False,0.75,,none
SSRE-GEOFLOW-1,Simulation of Geophysical Fluid Flow Under Microgravity-1,0,Not health-related,False,,,False,False,0.75,,none
SSRE-GEOFLOW-2,Simulation of Geophysical Fluid Flow Under Microgravity - 2,0,Not health-related,False,,,False,False,0.75,,none
SSRE-GEOGRAHIA-SHKOLA-GEOGRAPHY-SCHOOL,Geograhia-Shkola (Geography-School),0,Not health-related,False,,,False,False,0.75,,none
SSRE-GERMINATION-OF-ABI-VOYAGER-BARLEY-SEEDS-IN-MICROGRAVITY,Germination of ABI Voyager Barley Seeds in Microgravity,0,Not health-related,False,,,False,False,0.75,,none
SSRE-GET-FIT-FOR-SPACE,Get Fit for Space Challenge with Bob Thirsk,2,Probable,True,Cardiovascular diseases; Musculoskeletal diseases; Endocrine and metabolic diseases,Cardiovascular diseases,False,True,0.7,,ai_high
SSRE-GHS-01,Gifu High School Sat 01<br>,0,Not health-related,False,,,False,False,0.75,,none
SSRE-GISMOS,Genes in Space Molecular Operations and Sequencing,0,Not health-related,False,,,False,False,0.75,,none
SSRE-GLYKOPROTEID-K,Extraction and Investigation of surface glycoproteins E1-E2 Alphavirises on Earth and in Space,2,Probable,True,Neurological diseases; Rare inherited disorders,Neurological diseases,False,True,0.75,,ai_high
SSRE-GMETAL-AX-3,GMETAL,0,Not health-related,False,,,False,False,0.75,,none
SSRE-GOLF,Photo and Video Filming Onboard the Russian Segment of ISS,0,Not health-related,False,,,False,False,0.75,,none
SSRE-GOODYEAR-TIRE,Pushing the Limits of Silica Fillers for Tire Applications,0,Not health-related,False,,,False,False,0.75,,none
SSRE-GOSUM,Comparison of Seed Growth on Earth and in Space,0,Not health-related,False,,,False,False,0.75,,none
SSRE-GRANITSA-PK-BOUNDARY-PK,Studying Plasma Dust Crystals and Liquids in Microgravity on the ISS RS - Granitsa-PK,0,Not health-related,False,,,False,False,0.75,,none
SSRE-GRANULAR-SOUND,Granular Sound Characterization,0,Not health-related,False,,,False,False,0.75,,none
SSRE-GRAPE-JUICE-FERMENTATION-IN-MICROGRAVITY-ABOARD-ISS,Grape Juice Fermentation in Microgravity Aboard ISS,0,Not health-related,False,,,False,False,0.75,,none
SSRE-GRASP,Gravitational References for Sensimotor Performance:&nbsp; Reaching and Grasping,2,Probable,True,Neurological diseases; Musculoskeletal diseases,Neurological diseases,False,True,0.85,,ai_high
SSRE-GRAVI-2,Threshold Acceleration for Gravisensing - 2,0,Not health-related,False,,,False,False,0.75,,none
SSRE-GREEN-BONE,Green Bone in Microgravity,2,Probable,True,Musculoskeletal diseases; Endocrine and metabolic diseases,Musculoskeletal diseases,False,True,0.85,,ai_high
SSRE-GREENONYX,Duckweed Nano Growth Module,0,Not health-related,False,,,False,False,0.75,,none
SSRE-GREENONYX-DUCKWEED-PACK,Duckweed Safe Space Consumption in Zero Gravity,3,Uncertain,True,Endocrine and metabolic diseases; Cardiovascular diseases,Endocrine and metabolic diseases,False,True,0.6,,ai_low
SSRE-GRIP,GRIP,2,Probable,True,Neurological diseases,Neurological diseases,False,True,0.7,,ai_high
SSRE-GROUP-COMBUSTION,Elucidation of Flame Spread and Group Combustion Excitation Mechanism of Randomly-distributed Droplet Clouds,0,Not health-related,False,,,False,False,0.75,,none
SSRE-GROWTH-OF-ASSORTED-MICROGREENS-IN-MICROGRAVITY,Growth of Assorted Microgreens in Microgravity,3,Uncertain,True,Cardiovascular diseases; Endocrine and metabolic diseases; Musculoskeletal diseases,Cardiovascular diseases,False,True,0.5,,ai_low
SSRE-G-SATELLITE,G-SATELLITE,0,Not health-related,False,,,False,False,0.75,,none
SSRE-GT-1,Georgia Institute of Technology-1,0,Not health-related,False,,,False,False,0.75,,none
SSRE-GTS,GTS,0,Not health-related,False,,,False,False,0.75,,none
SSRE-GTS-2,Global Transmission Services 2,0,Not health-related,False,,,False,False,0.75,,none
SSRE-GTS-2-ROSCOSMOS,GTS-2-Roscosmos,0,Not health-related,False,,,False,False,0.75,,none
SSRE-GULBI,<span>Germicidal Ultraviolet Light Biofilm Inhibition</span><span>﻿</span>,3,Uncertain,True,Cardiovascular diseases; Kidney diseases,Cardiovascular diseases,False,True,0.4,,ai_low
SSRE-GUT-ON-CHIP,Organ-Chips as a Platform for Studying Effects of Space on Human Enteric Physiology,2,Probable,True,Endocrine and metabolic diseases,Endocrine and metabolic diseases,False,True,0.75,,ai_high
SSRE-GXIBA-1,Monitoring Ash from Active Volcanoes in Mexico,0,Not health-related,False,,,False,False,0.75,,none
SSRE-HABITABILITY,Habitability Assessment of International Space Station,2,Probable,True,Mental health; Musculoskeletal diseases; Cardiovascular diseases,Mental health,False,True,0.7,,ai_high
SSRE-HAIR,Biomedical Analyses of Human Hair Exposed to a Long-term Space Flight,2,Probable,True,Endocrine and metabolic diseases; Musculoskeletal diseases; Neurological diseases,Endocrine and metabolic diseases,False,True,0.7,,ai_high
SSRE-HALOSAT,HaloSat &ndash; A CubeSat to Study the Hot Galactic Halo,0,Not health-related,False,,,False,False,0.75,,none
SSRE-HARP,HyperAngular Rainbow Polarimeter,0,Not health-related,False,,,False,False,0.75,,none
SSRE-HBOND,Human Brain Organoid Models for Neurodegenerative Disease &amp; Drug Discovery,1,Confirmed,True,Neurological diseases,Neurological diseases,True,True,0.9,D019636,nlp+ai
SSRE-HDEV,High Definition Earth Viewing,0,Not health-related,False,,,False,False,0.75,,none
SSRE-HDTV-EF2,High Definition Television Camera-Exposed Facility 2,0,Not health-related,False,,,False,False,0.75,,none
SSRE-HDTV-ROSCOSMOS,HDTV-Roscosmos,0,Not health-related,False,,,False,False,0.75,,none
SSRE-HEADACHES-ON-ISS,Space-associated Physiological Mechanisms Affecting Space Headache,1,Confirmed,True,Neurological diseases,Neurological diseases,True,True,0.95,D006261|D010146,nlp+ai
SSRE-HEART,Physiological Parameters that Predict Orthostatic Intolerance After Spaceflight,2,Probable,True,Cardiovascular diseases,Cardiovascular diseases,False,True,0.9,,ai_high
SSRE-HEART-CELLS,Effects of Microgravity on Stem Cell-Derived Heart Cells,2,Probable,True,Cardiovascular diseases,Cardiovascular diseases,False,True,0.9,,ai_high
SSRE-HEAT-TRANSFER-HOST-2,Heat Transfer Host 2,0,Not health-related,False,,,False,False,0.75,,none
SSRE-HEAT-TRANSFER-HOST-2-COF,Heat Transfer Host 2 – Condensation on Fins,0,Not health-related,False,,,False,False,0.75,,none
SSRE-HELIOS,Hardened Extremely Long-life Information in Optical Storage,0,Not health-related,False,,,False,False,0.75,,none
SSRE-HEMOCUE,HemoCue WBC DIFF White Blood Cell Count and Differentiator Technology Demonstration,3,Uncertain,True,Cancer; Rare inherited disorders; Endocrine and metabolic diseases,Cancer,False,True,0.6,,ai_low
SSRE-HERMES-CASSETTE-1,Hermes Cassette-1,0,Not health-related,False,,,False,False,0.75,,none
SSRE-HEROES,High Entropy Rare-Earth Optimization for Environmental Barrier Coatings<br>,0,Not health-related,False,,,False,False,0.75,,none
SSRE-HETERO-3D,Thermo-physical Properties of Liquid and Heterogeneous Solidification Behavior of Powder Metals for 3D Printer,0,Not health-related,False,,,False,False,0.75,,none
SSRE-HET-SMARTPHONE,Human Exploration Telerobotics Smartphone,0,Not health-related,False,,,False,False,0.75,,none
SSRE-HICARI,Growth of Homogeneous SiGe Crystals in Microgravity by the TLZ Method,0,Not health-related,False,,,False,False,0.75,,none
SSRE-HICARI-II,Study of Silicon-Germanium Crystal Growth in Microgravity,0,Not health-related,False,,,False,False,0.75,,none
SSRE-HIGH-SAMPLE-CAPACITY-CUBELAB,High Sample Capacity CubeLab,0,Not health-related,False,,,False,False,0.75,,none
SSRE-HIGHER-ORBITS-MULTI-EXPERIMENT-MODULE,Higher Orbits Multi Experiment Module #4,0,Not health-related,False,,,False,False,0.75,,none
SSRE-HIMASSSEE,Spacecraft Single Event Environments at High Shielding Mass,2,Probable,True,Cancer; Neurological diseases,Cancer,False,True,0.7,,ai_high
SSRE-HIOR-EDU05,Higher Orbits Multi Experiment Module #5,0,Not health-related,False,,,False,False,0.75,,none
SSRE-HIOR-EDU06,Higher Orbits Multi Experiment Module #6,0,Not health-related,False,,,False,False,0.75,,none
SSRE-HIP-QCT,Feasibility Study: QCT Modality for Risk Surveillance of Bone - Effects of In-flight Countermeasures on Sub-regions of the Hip Bone,2,Probable,True,Musculoskeletal diseases,Musculoskeletal diseases,False,True,0.9,,ai_high
SSRE-HISUI,Hyper-Spectral Imager Suite,0,Not health-related,False,,,False,False,0.75,,none
SSRE-HMU-SAT-2,Teruteru World of Illuminate LIGHT&nbsp,0,Not health-related,False,,,False,False,0.75,,none
SSRE-HOKUSHIN-1,"Technology Demonstration of Propulsion, Ranging, and Deployable Solar Array Systems Using the HOKUSHIN-1 CubeSat",0,Not health-related,False,,,False,False,0.75,,none
SSRE-HOLOPORTATION-BEHAVIORAL-AX-1,Aexa’s Holographic Teleportation Behavioral,0,Not health-related,False,,,False,False,0.75,,none
SSRE-HOLTER-ECG,Digital Holter ECG,2,Probable,True,Cardiovascular diseases,Cardiovascular diseases,False,True,0.95,,ai_high
SSRE-HONEYWELL-MOREHEAD-DM-7,Honeywell-Morehead-DM-7,0,Not health-related,False,,,False,False,0.75,,none
SSRE-HOST-PATHOGEN,Spaceflight-Induced Changes in Microbial Virulence and the Impact to the Host Immune Response,3,Uncertain,True,Endocrine and metabolic diseases; Rare inherited disorders,Endocrine and metabolic diseases,False,True,0.6,,ai_low
SSRE-HOURGLASS,Hourglass,0,Not health-related,False,,,False,False,0.75,,none
SSRE-HPA,Hand Posture Analyzer,2,Probable,True,Neurological diseases; Musculoskeletal diseases,Neurological diseases,False,True,0.75,,ai_high
SSRE-H-REFLEX,Effects of Altered Gravity on Spinal Cord Excitability,2,Probable,True,Neurological diseases; Eye diseases,Neurological diseases,False,True,0.9,,ai_high
SSRE-HREP-HICO,HICO and RAIDS Experiment Payload - Hyperspectral Imager for the Coastal Ocean,2,Probable,True,Mental health,Mental health,False,True,0.9,,ai_high
SSRE-HREP-RAIDS,HICO and RAIDS Experiment Payload - Remote Atmospheric and Ionospheric Detection System (RAIDS),0,Not health-related,False,,,False,False,0.75,,none
SSRE-HRF-VEG,"Pick-and-Eat Salad-Crop Productivity, Nutritional Value, and Acceptability to Supplement the ISS Food System",2,Probable,True,Endocrine and metabolic diseases; Cardiovascular diseases; Mental health,Endocrine and metabolic diseases,False,True,0.7,,ai_high
SSRE-HSKSAT,HSKSAT,0,Not health-related,False,,,False,False,0.75,,none
SSRE-HSRC-DEMONSTRATION,HTV Small Re-entry Capsule Demonstration,0,Not health-related,False,,,False,False,0.75,,none
SSRE-HSU-SAT1,HSU-SAT1,0,Not health-related,False,,,False,False,0.75,,none
SSRE-HTV-WLAN-DEMO,HTV Wireless LAN Demonstration,0,Not health-related,False,,,False,False,0.75,,none
SSRE-HTV-ENVIRONMENTAL-MONITORING,Transport Environment Monitoring Package at HTV Cargo Transfer Bag,0,Not health-related,False,,,False,False,0.75,,none
SSRE-HUCSAT,Harvard Undergraduate CubeSat,0,Not health-related,False,,,False,False,0.75,,none
SSRE-HUMAN-DEXTERITY-AND-COGNITION-IN-A-SPACEFLIGHT-ENVIRONMENT,Human Dexterity and Cognition in a Spaceflight Environment,2,Probable,True,Neurological diseases; Mental health,Neurological diseases,False,True,0.85,,ai_high
SSRE-HUMAN-GUT-MICROBIOTA,The Impact of Staying on the Space Station in Low Earth Orbit (LEO) on the Human Gut Microbiota Analysed Through Targeted Sequencing of the 16S rRNA Gene Amplicons,2,Probable,True,Endocrine and metabolic diseases; Mental health; Cardiovascular diseases; Neurological diseases,Endocrine and metabolic diseases,False,True,0.85,,ai_high
SSRE-HUMAN-MUSCLE-ON-CHIP,Human Muscle Contraction Response in Microgravity,2,Probable,True,Musculoskeletal diseases; Neurological diseases; Cardiovascular diseases,Musculoskeletal diseases,False,True,0.95,,ai_high
SSRE-HUNCH-BALL-CLAMP-MONOPOD,High school students United with NASA to Create Hardware (HUNCH) Ball Clamp Monopod,0,Not health-related,False,,,False,False,0.75,,none
SSRE-HUNCH-TAPE-DISPENSER,High school students United with NASA to Create Hardware (HUNCH) Tape Dispenser,0,Not health-related,False,,,False,False,0.75,,none
SSRE-HUNCH-UTILITY-BRACKET,HUNCH Utility Bracket,0,Not health-related,False,,,False,False,0.75,,none
SSRE-HUNGARIAN-STEM-DEMO,Hungarian Science Technology Engineering and Mathematics Demonstration,0,Not health-related,False,,,False,False,0.75,,none
SSRE-HUSKYSAT-1,HuskySat-1,0,Not health-related,False,,,False,False,0.75,,none
SSRE-HYBRID-TRAINING,Effect of the Hybrid Training Method on the Disuse Atrophy of the Musculoskeletal System of the Astronauts Staying in the International Space Station for a Long Term-initial verification in ISS,1,Confirmed,True,Musculoskeletal diseases; Neurological diseases,Musculoskeletal diseases,True,True,0.9,D020966,nlp+ai
SSRE-HYDROGEL-FORMATION-AND-DRUG-RELEASE-IN-MICROGRAVITY-CONDITIONS,Investigation of the Effects of Microgravity on Controlled Release of Antibiotics and Curing Mechanism of a Novel Wound Dressing,3,Uncertain,True,Musculoskeletal diseases; Endocrine and metabolic diseases,Musculoskeletal diseases,False,True,0.6,,ai_low
SSRE-HYDROTROPI,Hydrotropism and Auxin-Inducible Gene expression in Roots Grown Under Microgravity Conditions,0,Not health-related,False,,,False,False,0.75,,none
